Filename,Sanat
365_days_of_vappu,
a_finnish_drinking_song,Now
ace_of_spades,":,: THE ACE OF SPADES
THE ACE OF SPADES :,:"
aku_ankka,":,: Aku Ankkako lapsemme turmelee?
Oh yeah, oh yeah :,:
Aku Iineksen kanssa seurustelee,
mutta naimisiin eivät he koskaan mee,
oh yeah, oh yeah, oh yeah.

:,: Aku Ankkahan housuja käytä ei,
Oh yeah, oh yeah :,:
Sitä lapsemme onneksi ei vielä tee,
vaan vaatteet päällä he kävelee,
oh yeah, oh yeah, oh yeah.

:,: Kuka TupuHupuLupun aikaan sai,
Oh yeah, oh yeah :,:
(Kertosäe lauletaan Sleepy Sleepers - Kuka,Mitä,Häh melodialla)
Olitko se sinä?
Vai olinko se minä?
A, mitä hä?

:,: Aku Ankka on ikuinen poikamies,
Oh yeah, oh yeah :,:
Kerran pari hän Iineksen ulos vei,
mutta sänkyyn saakka koskaan ei,
oh yeah, oh yeah, oh yeah.

:,: Pelle Peloton keksijä kelpo on,
Oh yeah, oh yeah :,:
Silti leluja hän vielä kokoilee,
vaikka pontikkaa pystyis' keitteleen,
oh yeah, oh yeah, oh yeah.

:,: Roope Ankka se naisissa hyppää ei,
Oh yeah, oh yeah :,:
Vaikka rahoillaan pystyis ostamaan
ihan millaisen missin haluais vaan,
oh yeah, oh yeah, oh yeah.

:,: Mitä tekevät ystävät Mikki ja Hessu?
Oh yeah, oh yeah :,:
Mikki menee Minnin kanssa motelliin,
Hessu etsii kundii poikkeevii,
oh yeah, oh yeah, oh yeah.

:,: Nyt kerromme, miksi teimme laulun tään,
Oh yeah, oh yeah :,:
Sanat valhetta on, mutta sitä en kadu:
""Hyvät vanhemmat!
Ostakaa nyt lapsillenne uusi Aku.""
oh yeah, oh yeah, oh yeah."
all_star,"Somebody once told me the world is gonna roll me
I ain't the sharpest tool in the shed
She was looking kind of dumb with her finger and her thumb
In the shape of an ""L"" on her forehead

Well the years start coming and they don't stop coming
Fed to the rules and I hit the ground running
Didn't make sense not to live for fun
Your brain gets smart but your head gets dumb
So much to do, so much to see
So what's wrong with taking the back streets?
You'll never know if you don't go
You'll never shine if you don't glow

Hey now, you're an all-star...

It's a cool place and they say it gets colder
You're bundled up now, wait till you get older
But the meteor men beg to differ
Judging by the hole in the satellite picture
The ice we skate is getting pretty thin
The water's getting warm so you might as well swim
My world's on fire, how about yours?
That's the way I like it and I never get bored

Hey now, you're an all-star...

Hey now, you're an all-star...

"
always_look_on_the_bright_side_of_life,"
Some things in life are bad, they can really make you mad
Other things just make you swear and curse
When you're chewing on life's gristle, don't grumble give a whistle
This will help things turn out for the best

Always look on the bright side of life
   \quarternote whistle melody \quarternote
Always look on the right side of life

If life seems jolly rotten, there's something you've forgotten
And that's to laugh and smile and dance and sing
When you're feeling in the dumps, don't be silly, chumps
Just purse your lips and whistle, that's the thing

So, always look on the bright side of death
Just before you draw your terminal breath

Life's a counterfeit and when you look at it
Life's a laugh and death's the joke, it's true
You see, it's all a show, keep them laughing as you go
Just remember the last laugh is on you

Always look on the bright side of life
And always look on the right side of life
Always look on the bright side of life
And always look on the right side of life"
aqua_vera,"Lauletaanpas vedestä,
jota aina riittää.
Vaikka kuinka joisit sä,
ei se lopu siitä.

Pikku Aqun jano on,
niin myös Paulin, Anteron.
AH, kun sentään hyvältä
paljas vesi maistuu.

:,: Och vatten och vatten
och vatten är så gott,
så rysligt, fasligt, billigt,
så hälsosamt och vått. :,:
1, 2, 3, VATTEN!

Entäs sitten aamulla
on olo mitä parhain.
Kannat vettä saavilla,
sängyn viereen varhain.

Aamuyöllä vessassa
tuumit sormi kurkussa
AH, kun sentään hyvältä
paljas vesi maistuu.

:,: Och vatten och vatten... :,:
1, 2, 3, 4!"
barbie_girl,"Hiya Barbie
Hi Ken!
Do you want to go for a ride?
Sure Ken.
Jump in.

I'm a Barbie girl, in a Barbie world
Life in plastic, it's fantastic.
You can brush my hair, undress me everywhere.
Imagination, life is your creation.

Come on Barbie, let's go party!

I'm a Barbie girl, in a Barbie world
Life in plastic, it's fantastic.
You can brush my hair, undress me everywhere.
Imagination, life is your creation.

I'm a blond bimbo girl, in a fantasy world,
Dress me up, make it tight, I'm your dolly.
You're my doll, rock'n'roll, feel the glamor in pink,
Kiss me here, touch me there, hanky panky.
You can touch, 
you can play, 
if you say ""I'm always yours""

I'm a Barbie girl, in a Barbie world
Life in plastic, it's fantastic.
You can brush my hair, undress me everywhere.
Imagination, life is your creation.

Come on Barbie, let's go party! (Ah ah ah yeah)
Come on Barbie, let's go party! (Oh oh)
Come on Barbie, let's go party! (Ah ah ah yeah)
Come on Barbie, let's go party! (Oh oh)

Make me walk, make me talk, do whatever you please,
I can act like a star, I can beg on my knees.
Come jump in, bimbo friend, let us do it again,
Hit the town, fool around, let's go party

You can touch, 
you can play, 
If you say ""I'm always yours""
You can touch, 
you can play, 
If you say ""I'm always yours""

Come on Barbie, let's go party! (Ah ah ah yeah)
Come on Barbie, let's go party! (Oh oh)
Come on Barbie, let's go party! (Ah ah ah yeah)
Come on Barbie, let's go party! (Oh oh)

I'm a Barbie girl, in a Barbie world
Life in plastic, it's fantastic.
You can brush my hair, undress me everywhere.
Imagination, life is your creation.

I'm a Barbie girl, in a Barbie world
Life in plastic, it's fantastic.
You can brush my hair, undress me everywhere.
Imagination, life is your creation.

Come on Barbie, let's go party! (Ah ah ah yeah)
Come on Barbie, let's go party! (Oh oh)
Come on Barbie, let's go party! (Ah ah ah yeah)
Come on Barbie, let's go party! (Oh oh)

Oh, I'm having so much fun!
Well Barbie, we are just getting started.
Oh, I love you Ken.

"
bohemian_rhapsody,"Is this the real life?
Is this just fantasy?
Caught in a landslide
No escape from reality
Open your eyes
Look up to the skies and see
I'm just a poor boy, I need no sympathy
Because I'm easy come, easy go
A little high, little low
Anyway the wind blows, doesn't really matter to me, to me

Mama, just killed a man
Put a gun against his head
Pulled my trigger, now he's dead
Mama, life had just begun
But now I've gone and thrown it all away
Mama, ooo
Didn't mean to make you cry
If I'm not back again this time tomorrow
Carry on, carry on, but nothing really matters

Too late, my time has come
Sends shivers down my spine
Body's aching all the time
Goodbye everybody I've got to go
Gotta leave you all behind and face the truth
Mama, ooo (anyway the wind blows)
I don't want to die
I sometimes wish I'd never been born at all

I see a little silhouetto of a man
Scaramouch, scaramouch will you do the fandango
Thunderbolt and lightning very very frightening me
Gallileo, Gallileo, 
Gallileo, Gallileo, 
Gallileo Figaro - magnifico

But I'm just a poor boy and nobody loves me
He's just a poor boy from a poor family
Spare him his life from this monstrosity
Easy come easy go will you let me go
Bismillah! No we will not let you go - let him go
Bismillah! We will not let you go - let him go
Bismillah! We will not let you go let me go
Will not let you go let me go (never)
Never let you go let me go
Never let me go ooo
No, no, no, no, no, no, no
Oh mama mia, mama mia, mama mia let me go
Beelzebub has a devil put aside for me
For me
For me

So you think you can stone me and spit in my eye
So you think you can love me and leave me to die
Oh baby can't do this to me baby
Just gotta get out just gotta get right outta here

Ooh yeah, ooh yeah
Nothing really matters
Anyone can see
Nothing really matters nothing really matters to me"
brännvin_vatten,"Smakar skit som katten.
Brännvin helt rått,
:,: smakar jävligt gott :,:

Viinaa, vettä,
mitä perkelettä.
Viinaa raakaa
:,: napaan kaatakaa :,:"
call_me_maybe,
de_brevitae_vitae,"Post iuacundam iuventutem, 
post molestam senectutem 
Nos habebit humus, nos habebit humus!

:,: Vivat academia, vivant professores! :,:
Vivant membrum quodlibet, 
vivant membra quaelibet, 
Semper sint in flore, semper sint in flore!

:,: Vivant omnes virgines, graciles formosae! :,:
Vivant et mulieres, 
tenerae, amabiles
:,: bonae laboriosae! :,:"
dodo_sorsa,"Hei Dodo-sorsa
Olet kadonnut keskellä yötä
räpylöittesi läpse vaimeni lähtösi myötä

Hei Dodo-sorsa
Jäi karttasi yöpöydän alle
sinun pelkään eksyvän yksin maailmalle

Kierränkö kanssa raidallisen matka arkun
läpi Närpiön, Piikkiön, Köyliön, Söörmarkun?
Tiedätkö, että kohta on syksy ja halla
yöt ovat liian kylmiä kaikkialla

Hei Köyliön pöllöt!
Oletteko kuulleet Dodosta?
On kadonnut Dodo-dodo-dodo lintukodosta
Hei radiot ja töllöt!
etsintäkuulutus eetteriin
saa muuten Dodo-dodo-dodo haulin höyheniin

Hei Dodo-sorsa
on höyhen pehmeä hellä
se kutittaa kun sitä pyöritän kämmennellä

Hei Dodo-sorsa
minä kökötän portaiden päässä
voi miten sinä pöhkö selviät pakkassäässä?

Hei Köyliön pöllöt!
Oletteko kuulleet Dodosta?
On kadonnut Dodo-dodo-dodo lintukodosta

Hei radiot ja töllöt!
etsintäkuulutus eetteriin
saa muuten Dodo-dodo-dodo haulin höyheniin

Hei Dodo-sorsa
tunnen viileän tuulen
ikävöin sinua huoli jo painaa mieltä
keinussa istun ja yhtä-äkkiä kuulen
tuttua läpsettä kaakatusta pihatieltä

Se on Do-do-do-do-do!……


"
dokataan,"Sitsit loppui ja meillä on pulloja vaan,
joissei viinaa oo jäljellä pisaraakaan.
Laskuhumalan oireita odotetaan,
juomat lopussi on, ei yhtään dokattavaa.

Pidä kiinni hei mua, niin mä pitää voin sua.
Kyllä kavereilta pitää aina saada tukea, HEI!

Mutta satoi tai paistoi, me yritetään,
päästä Matluklusterille yötä viettelemään.
Me on pihalla huudeltu: “Tuu avaamaan!”,
mutta jengi on baarissa tai sammunut vaan.

Pidä kiinni hei mua, niin mä pitää voin sua.
Kyllä kavereilta pitää aina saada tukea, HEI!

Hei me dokataan taas,
mutta ei me sammuta.
Darra uhkaa ehkä vähän,
mutta viel ei kaduta.

Hei me dokataan taas,
mutta mua ei okseta.
Vielä kossua on vähän,
nekin pitäis dokata.

Ei se minun syy oo,
jos on viinaa pullossa.
Parhaani mä teen,
mutta lattia on vinossa.
Aamunkoitteessa krapula vaivaa,
mua niin janottaa.
Viinaa on vielä kaikille vähän,
siis otetaan!
Hei me dokataan taas…"
drunken_sailor,":,: What shall we do with a drunken sailor :,:
What shall we do with a drunken sailor
early in the morning
:,: Hooray and up she rises :,:
Hooray and up she rises
early in the morning

:,: Shave his belly with a rusty razor :,:
Shave his belly with a rusty razor
early in the morning
:,: Hooray... :,:

:,: Put him in a long boat till he's sober :,:
Put him in a long boat till he's sober
early in the morning
:,: Hooray... :,:

:,: Keep him there and make him bale her :,:
Keep him there and make him bale her
early in the morning
:,: Hooray... :,:

:,: Stick him in a barrel with a hosepipe on him :,:
Stick him in a barrel with a hosepipe on him
early in the morning
:,: Hooray... :,:

:,: Put him in the bed with a captain's daughter :,:
Put him in the bed with a captain's daughter
early in the morning
:,: Hooray... :,:"
ei_tippa_tapa,"Kaikki alkoi siitä kun mä opintolainan sain,
sitten juhlan kunniaksi täyden lastin hain.
Eikä siinä turhaan liioin kainosteltu lain,
pullo kieris ringissä ja irvisteltiin vain.

;.; Ei tippa tapa ja ämpäri ei riitä,
kun on alkuun päästy niin antaa mennä vaan. ;.;

Elämä on tylsää jos ei aina juhli näin.
No kukas sitä joskus jaksaa olla selvin päin.
Antaa mennä samaan tahtiin vuosi peräkkäin.
Kaikki murheet huuhdotaan me sisältämme näin.

;.; Ei tippa tapa... ;.;

Kaikkihan me täällä ollaan pieni hetki vaan.
On aivan turhaa mammonaa näin koota päälle maan.
Joku Irwin kuitenkin ne ryyppää aikanaan.
Juodaan kaikki nyt ja juokoot toiset omiaan.

;.; Ei tippa tapa... ;.;"
eino_leinon_juomalaulu,"Monta päivää juotuaan
pessimisti tuskissaan,
tuumi: Nyt on, jumaliste,
saavutettu päätepiste!
Nuoranpätkä kourassaan
nurkkaan hiipi kuolemaan.
Mutta toiset, nähtyään
yhden poissa pöydästään,
sydämissään suuri hätä
alkoi etsiskellä tätä.
Löytyi veikko nuorastaan,
vainajana suorastaan.

Mutta:
Saatuansa spriitä,
virkistyi hän siitä.
Kohottaen lasiaan,
virkkoi: ""Veljet - asiaan!"""
eurovision_juomalaulu,"Ranskassa juodaan viiniä
Saksassa olutta ja Venäjällä vodkaa.
Suomessa juodaan kaikkea,
siis malja sille nostakaa!

Norjassa poltetaan kirkkoja,
Hollannissa pilveä ja Venäjällä vodkaa.
Suomessa poltetaan kaikkea,
siis malja sille nostakaa!

Grillissä palaa hiili,
juostessa rasva, Javan kanssa pinna.
Maksassa palaa viina,
siis malja sitä nostakaa!"
eye_of_the_tiger,
f-u-k-s-i,"Tulit landelta Helsinkiin
kaikki suurta ja uutta niin
tapasit tuutorin kuuman
koit ensihuuman
niin sitä alettiin.

Neuvot hyvät sulle annan:
“Lähde mukaan, messiin tuu!“
Kaljat bileisiin mä kannan
“Heitä mielestäs jo muu!“

Olit ujo nuori fuksi
muistin oitis: Älä kuksi!
Säännöt sanoo, älä koske
vaikka mieli tekiskin.
lal-lal-laa-la-la-lal-lal x4

F-U-K-S-I, fuksi fuksisein,
mä sanoin niin ja selväks tein,
me ollaan ystäviä vain,
oon sulle tuki, turva ain.
Olen tuutorisi, niin,
en tiedä kuinka sanoisin sen paremmin.

F-U-K-S-I, fuksi fuksisein,
mä vaikka sanoin sulle ei,
me voidaan Manta lakittaa,
ja vähän skumppaa kallistaa.
Se onkin onni, että saa
Ulliksella kanssas ristiin oksentaa."
fast_food_song,":,: A Pizza Hut, a Pizza Hut
Kentucky Fried Chicken and a Pizza Hut :,:
:,: McDonalds, McDonalds
Kentucky fried chicken and a Pizza Hut :,:"
felix,"Felix, felix, felix! 
Herkkuja ruokapöytään."
finlandia,"Oi Suomi, katso, sinun päiväs' koittaa,
yön uhka karkoitettu on jo pois,
ja aamun kiuru kirkkaudessa soittaa
kuin itse taivahan kansi sois'.
Yön vallat aamun valkeus jo voittaa,
sun päiväs' koittaa, oi synnyinmaa.

Oi nouse, Suomi, nosta korkealle
pääs' seppelöimä suurten muistojen,
oi nouse, Suomi, näytit maailmalle
sa että karkoitit orjuuden
ja ettet taipunut sa sorron alle,
on aamus' alkanut, synnyinmaa."
finlandssvensk_snapsvisa,Nu!
friday,"Seven a.m., waking up in the morning
Gotta be fresh, gotta go downstairs
Gotta have my bowl, gotta have cereal
Seein' everything, the time is goin'
Tickin' on and on, everybody's rushin'
Gotta get down to the bus stop
Gotta catch my bus, I see my friends (My friends)

Kickin' in the front seat
Sittin' in the back seat
Gotta make my mind up
Which seat can I take?

It's Friday, Friday
Gotta get down on Friday
Everybody's lookin' forward to the weekend, weekend
Friday, Friday
Gettin' down on Friday
Everybody's lookin' forward to the weekend

Partyin', partyin' (Yeah)
Partyin', partyin' (Yeah)
Fun, fun, fun, fun
Lookin' forward to the weekend

7:45, we're drivin' on the highway
Cruisin' so fast, I want time to fly
Fun, fun, think about fun
You know what it is
I got this, you got this
My friend is by my right, ay
I got this, you got this
Now you know it

Kickin' in the front seat
Sittin' in the back seat
Gotta make my mind up
Which seat can I take?

It's Friday, Friday..."
fuksipuksi,"Ottaisin minä pienen fuksin
jos vain kiinni saisin.
:,: Pieneen koriin pistäisin
ja baariin kuljettaisin :,:

Tiutautiutautilitalitittan
kylläpä fuksit on kännissä.
:,: Kun niille pikkasen viinaa antaa
niin on ne mukana rännissä :,:

Vaan eipä taida meidän fuksit
tätä kyytiä kestää.
:,: Pian ne Klusterin sohvilla sammuu
eikä voi laattaa estää :,:

Tiutautiutau...."
gurulah,"Ikkunaa vasten näin
sovelman kaatuvan jälleen,
poikkeuksen heittänyt
ilmoille on rakkaimpain.
Murhaa on moinen,
sydämein kuolevan tunsin kun ceen
nähdä sain.

Ei, ei, ei, Gurulah!
Ai, ai, voi, Gurulah!
Käänsin sen, taas kerran mä
käänsin sen.
Menetin kaiken, sä aatoksein
juomiseen veit.

Kääntää en sovelmaa voinut,
jäin konsolin ääreen.
Aamu jo valkeni,
kun muiden saapuvan näin.
Nauroin, kun kaaduit.
Tuskani vallassa hillinnyt en itseäin.
Ei, ei, ei, 71 117 114 117 108 97 104!
Ai, ai, voi,
%47%75%72%75%6C%61%68!
Käänsin sen, taas kerran mä
käänsin sen.
Menetin kaiken, sä aatoksein
juomiseen veit."
hauki_ja_viina,"Katonrajass' kulkee hauki,
pahaa taitaa tarkoittaa!
:,: Kierrä pullon korkki auki,
ryyppy pedon karkoittaa. :,:

Pöydän alta ryömii lisko,
ilkein silmin tuijottaa.
:,: Ryyppy toinen naamaas kisko,
aistiharha lähdön saa. :,:

Vierustuolill' istuu hylje,
pyrstö läpsii palleaas'.
:,: Kunhan vain et lasiin sylje,
mursu daamiks' muuttuu taas. :,:

Pöydän päällä ammuu nauta,
maitoo koittaa tyrkyttää.
:,: Ryyppy neljäs, jumalauta,
maitohapot myrkyttää. :,:

Uppå väggen går en gädda
med långa ludna svarta ben,
:,: men ni ska inte vara rädda,
tag en sup och allt går väl. :,:

Vita möss som går i taket
råna hest och falla ner,
:,: men ni ska inte vara rädda,
tag en sup och allt gör väl. :,:"
hei_vahtimestari,":,: Hei vahtimestari!
Tule, täytä lasini.
Vie tyhjät pullot pois! :,:
:,: Kyllä enemmänkin juodaan,
jos vain lisää tuodaan,
ja laskut maksetaan jos jaksetaan. :,:

:,: Hei vahtimestari!
Tule täytä lasini.
Vie kuolleet fuksit pois! :,:
:,: Ja kun mä kerran kuolen,
kyll' firma pitää huolen,
ett' Vanhan Kellariin mut haudataan. :,:"
helan_gor,"(Soolo:)
En liten fågel satt en gång
och sjöng i furuskog,
han hade sjungit dagen lång
men dock ej sjungit nog.
Vad sjöng den lilla fågeln då?

(Kaikki:)
Helan går,
sjung hoppfaderallan lallan lej
Helan går, sjung hoppfaderallan lej
Och den som inte helan tar,
han ej heller halvan får.
Helan går...
- sjung hoppfaderallan lej!"
hell_and_gore,"Hell and gore,
shun gop, Father Allan, lallen lay.
Hell and gore,
shun gop, Father Allan lay.
Oh, handsome in the Hell and tar,
hand, ay Hell are half and four.
Hell and gore -
Shun gop, Father Allan lay!"
henkilokunta,":,: Henkilökuntaa, henkilökuntaa, parlevuu. :,:
Henkilökuntaa, henkilökuntaa,
henkilökuntaa, henkilökuntaa.
:,: Henkilökuntaa parlevuu. :,:
 
Lissää viinaa...
Konjakki ois poikaa...
Kaljakin kelpaa...
Fuksit kuolee...
Vanhat jaksaa...
TKO-äly maksaa..."
hey-song,"And so I cry sometimes when I'm lying in bed
Just to get it all out what's in my head
And I, I'm feeling a little peculiar

And so I wake in the morning and I step outside
And I take a deep breath and get real high
And I scream from the top of my lungs
What's goin' on?

And I say hey, yeah, yeah, yeah yay
Hey, yay, yay
I said hey, what's goin' on?

And I say hey, yeah, yeah, yeah yay
Hey, yay, yay
I said hey, what's goin' on?

And he tries
Oh my God, do I try
I try all the time,
In this institution

And he prays
Oh my God, do I pray
I pray every single day
(Nyaaah)
For a revolution!
"
hullu_kirvesmies,"Illalla, kun mielipuoli kirveen saa,
hän johdattaa mut aitan taa,
siellä missä aivokoppa aukeaa
ja verikin on punaisin.

Nauraen lyö hullu niskan taa,
tunnen sen jo veri tirskahtaa.
Vaikk’ on taju himmennytkin,
hullu hakkaa vielä nytkin
niskantynkää verta pursuvaa."
hypermedialaulu,"Javaskripti, javaskripti, C++, C++,
Corba sekä Perli, Corba sekä Perli,
SQL, SQL.

HTML, HTML, XML, XML,
Flashi sekä QuickTime, Flashi sekä QuickTime,
CSS, CSS."
ievan_polkka,
internationaali,"Hei, neiti pullot eteem' tuokaa
oi kuulu raisu laulumme.
Hei, veikot kaikki pois te juokaa
tää on viimeinen kännimme.
Pohja vanha sivistyksen horjuu
ei se meitä liikuta.
Alas lyökää koko vanha maailma
on kaikki samantekevää.

Tää on viimeinen känni
seurahamme yhtykää,
niin murheet kaikki poistuu
sun kanssas' hautahan.

Ei muuta johtajaa ei luojaa
kuin viina aina maistuva.
Se meidän onnen takaa, turvaa,
siks' on meidän juotava.
Eestä viinin, laulun naistenkin
tässä juomme, nautimme.
Lasit ylös, kurjat nostakaatte
me tähän uhraam' henkemme.

Tää on viimeinen ...

En koskaan tehnyt itse työtä
vaan aina siivel' elelin.
Varat eukon hankkimat on menneet
kaikki raflan laskuihin.
Pois murheet kaikki vanhat juomme,
meille ruumisarkku tuotakoon.

Tää on viimeinen ..."
internationalen,"Mera brännvin i glasen,
mera glas på vårt bord,
mera bord på kalasen,
mera kalas på vår jord.
Mera jordar kring månen,
mera månar kring Mars,
mera marscher till Skåne,
mera Skåne, bevars!

Lisää viinaa mun lasiin,
lisää laseja pöydälle.
Lisää pöytiä näihin juhliin,
lisää juhlia kansalle.
Lisää kansaa Suomeen,
lisää Suomea päälle maan.
Lisää maata Suomeen,
marssitaan, marssitaan, Karjalaan,
KARJALAAN!"
intian_kuu,"Intiassa kuukin on kuumempi
oo-hiio-hei!
Kuin aurinko meillä vaan suurempi
oo-hiio-hei!
Ja kerran se lakkini sytytti
oo-hiio-hei!
Olin kännissä silloin tietysti
oo-hiio-hei!

:,: Hei juttele sinä vaan,
kyllä sinut tunnetaan
ja vaikka sen valheeksi vannotkin
niin kyllä sua uskotaan :,:

Linnut siellä paistuivat lennossa
Ja voi siellä myytiin pullossa
Ja jok'ikinen kala joka ongittiin
Oli keitettynä kun se nostettiin

Hei juttele sinä vaan...

Intiassa ankkuri nostettiin
Ja Punaiseen Mereen se laskettiin
Ja sen minä voin vaikka vannoa,
Että seilasimme puolukkahillossa

Hei juttele sinä vaan...

Näin minä Niilin rannikot
Näin krokotiilit ja faaraot
Siellä muumiot eli niinkuin ennenkin
Ja lähettivät terveiset teillekin

Hei juttele sinä vaan...

Pyramiidin huipull' oli majakka
Ja majakass' oli kapakka
Ja siellä me kävimme ryypyllä
Ja muumioitten kanssa hypyllä

Hei juttele sinä vaan...

Siellä näin minä neekerityttösen
Niin sievän, hennon ja herttaisen
Vaan yks murjaani juoksi mun perääni
Ja halkaisi kirveellä kalloni

Hei juttele sinä vaan...

Kun me purjehdimme Kreetalle
Niin Välimeri haiskahti sillille
Siellä seireenit lauloivat kuorossa
Oli uintiretki siis vuorossa

Hei juttele sinä vaan...

Siellä tutustuin seireenityttöseen
Niin sievään, hentoon ja herttaiseen
Vaan kun suutelin sitä pyrstölleen
Se haukkas mun perseeni lounaakseen

Hei juttele sinä vaan...

Kreikan nienten takana
Väijyi alkoholisti pakana
Se entrasi meidän kylkehen
Juotti pontikkaa perämiehellen

Hei juttele sinä vaan...

Perämiehemme pontikkakänninen
Vei meidät Maltan saarellen
Vaan kun saari oli pieni niin
Me purjehdimme sen upoksiin

Hei juttele sinä vaan...

Ja laivalla karttapallona
Oli suuren suuri peruna
Vaan kun muona alkoi loppua
Meidän täytyi syödä Afrikka

Hei juttele sinä vaan..."
jallu,"Jallu, sen mä kaadan ineen.
Jallu, meill' on yhden tähden bileet.
Jallu, maksa puskee hikee.
Jallu, Jallu, Jallu, Jallu."
jallutähden_alla,"Täällä jallutähden alla
korkeimmalla kukkulalla.
Katson läpi lasin tyhjän,
sen täytän uudestaan.

Täällä jallutähden alla,
lasi täyttyy leikatulla.
Siitä suojakseni peiton,
minä itselleni saan.

Ja alla jallutähden,
minä otan,
yhden tähden,
ja vain jallutähden nähden,
itken ilon kyyneleen.

Täällä jallutähden alla,
kova jano laulajalla.
Huolet viinaa naukkaamalla
siirtyy päivään huomiseen

Täällä jallutähden alla,
hiipii sieluun asti halla,
mutta korkin avaamalla,
sulaa sydän uudelleen.

Ja alla jallutähden..."
jallutyttö,"Mul on ollu naisia, vähän kaikenlaisia, mut vaan yksi jallutyttö.
Tapasin sen vuosi sitten koitin tarjoo sille bissen, hän mulle nauroi vaan.
Ja sit mä tajusin

Sille ei kelpaa siiderit, ei mitkään litkun mikserit, otetaan jotain vahvempaa jallut tytönkaa. Ei jaksa litkii lomppua, eikä kaljas oo tarpeeks potkua, otetaan jotain vahvempaa jallut tytönkaa.

Jotain vahvempaa, jallut tytönkaa
Jotain vahvempaa, jallut tytönkaa

Maailmas ei oo monta miestä, joka voi juomisessa piestä, pää-äijän
Se tyttö joi mut pöydän alle juomat kaatuu lattialle, hän mulle nauroi vaan
Ja mä tajusin

Sille ei kelpaa siiderit, ei mitkään litkun mikserit, otetaan jotain vahvempaa jallut tytönkaa. Ei jaksa litkii lomppua, eikä kaljas oo tarpeeks potkua, otetaan jotain vahvempaa jallut tytönkaa

Jotain vahvempaa, jallut tytönkaa
Jotain vahvempaa, jallut tytönkaa

Nyt en häntä enää löydä, ja mä istun yksin pöydäs, oi jallutyttö.
Ei maistu jallu samalta, otan bissen hanasta, hän mulle naurais vaan
Ja mä muistan

Sille ei kelpaa siiderit ei mitkään litkun mikserit, otetaan jotain vahvempaa jallut tytönkaa. Ei jaksa litkii lomppua, eikä kaljas oo tarpeeks potkua, otetaan jotain vahvempaa jallut tytönkaa

Jotain vahvempaa, jallut tytönkaa
Jotain vahvempaa, jallut tytönkaa

"
jaloviinaa,"Susinaisesta kuullut mä oon tarinoita
kuinka tuo noita naisen hahmossa vei
miehen joka myöhemmin suruunsa juuttui
kuin kiveksi muuttui, enää puhukkaan ei

Hän vain juo jaloviinaa
viileää viinaa, kuin vettä vain juo
Hän läikyttää lasissaan ruskeaa viinaa
ja tien muistaa ruskeiden silmien luo

Vuosia myöhemmin naisesta kuulin
joka elelee yksinään Naarvassa päin
Ja riutunut mies roudaa hänelle viinaa
vie jaloviinaa hälle ämpäreittäin

Ja hän vain juo jaloviinaa
viileää viinaa, kuin vettä vain juo
Ovat silmänsä kuulema kuin jaloviinaa
lämpimän ruskeat kuin viina tuo

Ja hän vain juo jaloviinaa
viileää viinaa, kuin vettä vain juo
Hän läikyttää lasissaan ruskeaa viinaa
ja tien muistaa ruskeiden silmien luo"
